iomega@ix4-200d:~$ sudo lspci -nn
00:01.0 PCI bridge [0604]: Marvell Technology Group Ltd. 88F6281 [Kirkwood] ARM SoC [11ab:6281] (rev 03)
01:00.0 IDE interface [0101]: Marvell Technology Group Ltd. 88SE6111/6121 SATA II / PATA Controller [11ab:6121] (rev b2)

iomega@ix4-200d:~$ sudo lspci -vv
00:01.0 PCI bridge: Marvell Technology Group Ltd. 88F6281 [Kirkwood] ARM SoC (rev 03) (prog-if 00 [Normal decode])
        Device tree node: /sys/firmware/devicetree/base/mbus@f1000000/pcie@82000000/pcie@1,0
        Control: I/O+ Mem+ BusMaster+ SpecCycle- MemWINV- VGASnoop- ParErr+ Stepping- SERR+ FastB2B- DisINTx-
        Status: Cap+ 66MHz- UDF- FastB2B- ParErr- DEVSEL=fast >TAbort- <TAbort- <MAbort- >SERR- <PERR- INTx-
        Latency: 0, Cache Line Size: 64 bytes
        Bus: primary=00, secondary=01, subordinate=01, sec-latency=0
        I/O behind bridge: 00010000-00010fff [size=4K]
        Memory behind bridge: e0000000-e00fffff [size=1M]
        Prefetchable memory behind bridge: 00000000-000fffff [size=1M]
        Secondary status: 66MHz- FastB2B- ParErr- DEVSEL=fast >TAbort- <TAbort- <MAbort- <SERR- <PERR-
        BridgeCtl: Parity+ SERR+ NoISA- VGA- VGA16- MAbort- >Reset- FastB2B-
                PriDiscTmr- SecDiscTmr- DiscTmrStat- DiscTmrSERREn-
        Capabilities: [40] Subsystem: Marvell Technology Group Ltd. 88F6281 [Kirkwood] ARM SoC
        Capabilities: [48] Express (v1) Root Port (Slot+), MSI 00
                DevCap: MaxPayload 128 bytes, PhantFunc 0
                        ExtTag- RBE+
                DevCtl: CorrErr- NonFatalErr- FatalErr- UnsupReq-
                        RlxdOrd- ExtTag- PhantFunc- AuxPwr- NoSnoop-
                        MaxPayload 128 bytes, MaxReadReq 512 bytes
                DevSta: CorrErr- NonFatalErr- FatalErr- UnsupReq- AuxPwr- TransPend-
                LnkCap: Port #0, Speed 2.5GT/s, Width x1, ASPM L0s L1, Exit Latency L0s <256ns, L1 unlimited
                        ClockPM- Surprise- LLActRep+ BwNot- ASPMOptComp-
                LnkCtl: ASPM Disabled; RCB 128 bytes, Disabled- CommClk-
                        ExtSynch- ClockPM- AutWidDis- BWInt- AutBWInt-
                LnkSta: Speed 2.5GT/s (ok), Width x1 (ok)
                        TrErr- Train- SlotClk+ DLActive+ BWMgmt- ABWMgmt-
                SltCap: AttnBtn- PwrCtrl- MRL- AttnInd- PwrInd- HotPlug- Surprise-
                        Slot #1, PowerLimit 0.000W; Interlock- NoCompl-
                SltCtl: Enable: AttnBtn- PwrFlt- MRL- PresDet- CmdCplt- HPIrq- LinkChg-
                        Control: AttnInd Unknown, PwrInd Unknown, Power- Interlock-
                SltSta: Status: AttnBtn- PowerFlt- MRL- CmdCplt- PresDet+ Interlock-
                        Changed: MRL- PresDet- LinkState-
                RootCap: CRSVisible-
                RootCtl: ErrCorrectable- ErrNon-Fatal- ErrFatal- PMEIntEna- CRSVisible-
                RootSta: PME ReqID 0000, PMEStatus- PMEPending-
        Capabilities: [100 v1] Advanced Error Reporting
                UESta:  DLP- SDES- TLP- FCP- CmpltTO- CmpltAbrt- UnxCmplt- RxOF- MalfTLP- ECRC- UnsupReq- ACSViol-
                UEMsk:  DLP- SDES- TLP- FCP- CmpltTO- CmpltAbrt- UnxCmplt- RxOF- MalfTLP- ECRC- UnsupReq- ACSViol-
                UESvrt: DLP+ SDES- TLP- FCP- CmpltTO- CmpltAbrt- UnxCmplt- RxOF+ MalfTLP+ ECRC- UnsupReq- ACSViol-
                CESta:  RxErr- BadTLP- BadDLLP- Rollover- Timeout- AdvNonFatalErr-
                CEMsk:  RxErr- BadTLP- BadDLLP- Rollover- Timeout- AdvNonFatalErr+
                AERCap: First Error Pointer: 00, ECRCGenCap- ECRCGenEn- ECRCChkCap- ECRCChkEn-
                        MultHdrRecCap- MultHdrRecEn- TLPPfxPres- HdrLogCap-
                HeaderLog: 4a000001 01000004 01080000 23010000
                RootCmd: CERptEn- NFERptEn- FERptEn-
                RootSta: CERcvd- MultCERcvd- UERcvd- MultUERcvd-
                         FirstFatal- NonFatalMsg- FatalMsg- IntMsg 0
                ErrorSrc: ERR_COR: 0000 ERR_FATAL/NONFATAL: 0000

01:00.0 IDE interface: Marvell Technology Group Ltd. 88SE6111/6121 SATA II / PATA Controller (rev b2) (prog-if 8f [PCI native mode controller, supports both channels switched to ISA compatibility mode, supports bus mastering])
        Subsystem: Marvell Technology Group Ltd. 88SE6111/6121 1/2 port SATA II + 1 port PATA Controller
        Control: I/O+ Mem+ BusMaster+ SpecCycle- MemWINV- VGASnoop- ParErr+ Stepping- SERR+ FastB2B- DisINTx-
        Status: Cap+ 66MHz- UDF- FastB2B- ParErr- DEVSEL=fast >TAbort- <TAbort- <MAbort- >SERR- <PERR- INTx-
        Latency: 0, Cache Line Size: 32 bytes
        Interrupt: pin A routed to IRQ 35
        Region 0: I/O ports at 10010 [size=8]
        Region 1: I/O ports at 10020 [size=4]
        Region 2: I/O ports at 10018 [size=8]
        Region 3: I/O ports at 10024 [size=4]
        Region 4: I/O ports at 10000 [size=16]
        Region 5: Memory at e0000000 (32-bit, non-prefetchable) [size=1K]
        Capabilities: [48] Power Management version 2
                Flags: PMEClk- DSI- D1+ D2- AuxCurrent=0mA PME(D0+,D1+,D2-,D3hot+,D3cold-)
                Status: D0 NoSoftRst- PME-Enable- DSel=0 DScale=1 PME-
        Capabilities: [50] MSI: Enable- Count=1/1 Maskable- 64bit-
                Address: 00000000  Data: 0000
        Capabilities: [e0] Express (v1) Legacy Endpoint, MSI 00
                DevCap: MaxPayload 128 bytes, PhantFunc 0, Latency L0s unlimited, L1 unlimited
                        ExtTag- AttnBtn- AttnInd- PwrInd- RBE- FLReset-
                DevCtl: CorrErr- NonFatalErr- FatalErr- UnsupReq-
                        RlxdOrd- ExtTag- PhantFunc- AuxPwr+ NoSnoop-
                        MaxPayload 128 bytes, MaxReadReq 512 bytes
                DevSta: CorrErr- NonFatalErr- FatalErr- UnsupReq- AuxPwr- TransPend-
                LnkCap: Port #0, Speed 2.5GT/s, Width x1, ASPM L0s, Exit Latency L0s <256ns
                        ClockPM- Surprise- LLActRep- BwNot- ASPMOptComp-
                LnkCtl: ASPM Disabled; RCB 64 bytes, Disabled- CommClk-
                        ExtSynch- ClockPM- AutWidDis- BWInt- AutBWInt-
                LnkSta: Speed 2.5GT/s (ok), Width x1 (ok)
                        TrErr- Train- SlotClk+ DLActive- BWMgmt- ABWMgmt-
        Capabilities: [100 v1] Advanced Error Reporting
                UESta:  DLP- SDES- TLP- FCP- CmpltTO- CmpltAbrt- UnxCmplt- RxOF- MalfTLP- ECRC- UnsupReq- ACSViol-
                UEMsk:  DLP- SDES- TLP- FCP- CmpltTO- CmpltAbrt- UnxCmplt- RxOF- MalfTLP- ECRC- UnsupReq- ACSViol-
                UESvrt: DLP+ SDES- TLP- FCP+ CmpltTO- CmpltAbrt- UnxCmplt- RxOF+ MalfTLP+ ECRC- UnsupReq- ACSViol-
                CESta:  RxErr- BadTLP- BadDLLP- Rollover- Timeout- AdvNonFatalErr-
                CEMsk:  RxErr- BadTLP- BadDLLP- Rollover- Timeout- AdvNonFatalErr+
                AERCap: First Error Pointer: 1f, ECRCGenCap- ECRCGenEn- ECRCChkCap- ECRCChkEn-
                        MultHdrRecCap- MultHdrRecEn- TLPPfxPres- HdrLogCap-
                HeaderLog: 00000000 00000000 00000000 00000000
        Kernel driver in use: ahci
        Kernel modules: ahci
